{
  "schemaVersion": 1,
  "unitId": "chapter-observer-patterns-parts-part-i-what-begins-why-collaboration-is-hard",
  "editionSlug": "observer-patterns",
  "chapterSlug": "parts-part-i-what-begins-why-collaboration-is-hard",
  "sourcePath": "parts/part-i-what-begins/why-collaboration-is-hard.md",
  "sourceHash": "sha256:e5a0b0c39fde3aaa9be63b0f601ceaa746754f1058ab3e51a85e37564c8a45b9",
  "spokenTextHash": "sha256:1b067bb577bc37a6579778a657a427542c315ff00229969562596be644654505",
  "generationHash": "sha256:5ed950c7e0a12769b332c18f8f22721e7c1dadc2b40346337dc1a80826c791d6",
  "pipelineVersion": 1,
  "extractorVersion": 1,
  "provider": "elevenlabs",
  "providerAdapterVersion": "1",
  "model": "eleven_flash_v2_5",
  "voice": {
    "alias": "reflective-narrator",
    "providerVoiceId": "sb2VZCPgS2OECd1UfmTX"
  },
  "outputFormat": "mp3_44100_128",
  "language": "en",
  "includeTitle": true,
  "includeFootnotes": false,
  "spokenCharacters": 389,
  "estimatedUsage": {
    "unit": "credits",
    "amount": 389.0,
    "usd": null
  },
  "actualUsage": {
    "unit": "credits",
    "amount": 389.0,
    "usd": null
  },
  "providerGenerationId": null,
  "alignment": {
    "granularity": "segment-only",
    "path": "books/observer-patterns/audio/parts-part-i-what-begins-why-collaboration-is-hard.alignment.json"
  },
  "audioPath": "books/observer-patterns/audio/parts-part-i-what-begins-why-collaboration-is-hard.mp3",
  "audioSha256": "sha256:ebdd53caf24ead8281bec6587d9f052ffac6c854e600b00fb59aed6275f5c36b",
  "generatedAt": "2026-08-05T03:46:50Z"
}
